{
  "schema_version": 1,
  "kind": "yazses-injection-matrix-result",
  "recorded_at": "2026-10-22T08:11:24+00:00",
  "fixture_set": {
    "version": "1",
    "sha256": "c2d7dae3fe5c6ec40fa313ce0260b45236e8102f33a18872cb718a38cf5bd350"
  },
  "environment": {
    "os": "windows",
    "os_version": "Windows 11 10.0.22621",
    "session": "none",
    "python_version": "3.11.9",
    "yazses_version": "yazses 2.43.2+main.e224b67e (source checkout)",
    "backend": "WindowsInjector",
    "backend_version": null,
    "receiver": "tk",
    "target_app": "Tk text box (injectmatrix receiver)",
    "target_app_version": null
  },
  "receiver_selftest": {
    "en-control": true,
    "fa-plain": true,
    "fa-zwnj": true,
    "fa-double-zwnj": true,
    "fa-boundary-zwnj": true,
    "fa-arabic-variants": true,
    "fa-en-product-names": true,
    "fa-email-path": true,
    "fa-url": true,
    "fa-persian-digits": true,
    "fa-mixed-digits": true,
    "fa-punctuation-spliced": true,
    "fa-punctuation-quotes": true,
    "fa-bidi-controls": true,
    "fa-emoji": true,
    "fa-emoji-sequences": true,
    "fa-multiline": true,
    "fa-multiline-paths": true,
    "fa-long-paragraph": true
  },
  "stray_captures": 0,
  "cases": [
    {
      "fixture_id": "en-control",
      "categories": [
        "control"
      ],
      "expected_code_points": [
        "U+006B",
        "U+0075",
        "U+0062",
        "U+0065",
        "U+0063",
        "U+0074",
        "U+006C",
        "U+0020",
        "U+0067",
        "U+0065",
        "U+0074",
        "U+0020",
        "U+0070",
        "U+006F",
        "U+0064",
        "U+0073",
        "U+0020",
        "U+002D",
        "U+002D",
        "U+006E",
        "U+0061",
        "U+006D",
        "U+0065",
        "U+0073",
        "U+0070",
        "U+0061",
        "U+0063",
        "U+0065",
        "U+0020",
        "U+0070",
        "U+0072",
        "U+006F",
        "U+0064",
        "U+0020",
        "U+0026",
        "U+0026",
        "U+0020",
        "U+0063",
        "U+0061",
        "U+0074",
        "U+0020",
        "U+0073",
        "U+0072",
        "U+0063",
        "U+002F",
        "U+006D",
        "U+0061",
        "U+0069",
        "U+006E",
        "U+002E",
        "U+0070",
        "U+0079"
      ],
      "received_code_points": [
        "U+006B",
        "U+0075",
        "U+0062",
        "U+0065",
        "U+0063",
        "U+0074",
        "U+006C",
        "U+0020",
        "U+0067",
        "U+0065",
        "U+0074",
        "U+0020",
        "U+0070",
        "U+006F",
        "U+0064",
        "U+0073",
        "U+0020",
        "U+002D",
        "U+002D",
        "U+006E",
        "U+0061",
        "U+006D",
        "U+0065",
        "U+0073",
        "U+0070",
        "U+0061",
        "U+0063",
        "U+0065",
        "U+0020",
        "U+0070",
        "U+0072",
        "U+006F",
        "U+0064",
        "U+0020",
        "U+0026",
        "U+0026",
        "U+0020",
        "U+0063",
        "U+0061",
        "U+0074",
        "U+0020",
        "U+0073",
        "U+0072",
        "U+0063",
        "U+002F",
        "U+006D",
        "U+0061",
        "U+0069",
        "U+006E",
        "U+002E",
        "U+0070",
        "U+0079"
      ],
      "codepoint_verdict": "EXACT",
      "first_divergence": null,
      "corruption_hints": [],
      "visual_check": {
        "status": "pending",
        "notes": ""
      }
    },
    {
      "fixture_id": "fa-plain",
      "categories": [
        "persian"
      ],
      "expected_code_points": [
        "U+0633",
        "U+0644",
        "U+0627",
        "U+0645",
        "U+0020",
        "U+062F",
        "U+0646",
        "U+06CC",
        "U+0627"
      ],
      "received_code_points": [
        "U+0633",
        "U+0644",
        "U+0627",
        "U+0645",
        "U+0020",
        "U+062F",
        "U+0646",
        "U+06CC",
        "U+0627"
      ],
      "codepoint_verdict": "EXACT",
      "first_divergence": null,
      "corruption_hints": [],
      "visual_check": {
        "status": "pending",
        "notes": ""
      }
    },
    {
      "fixture_id": "fa-zwnj",
      "categories": [
        "persian",
        "zwnj"
      ],
      "expected_code_points": [
        "U+0645",
        "U+06CC",
        "U+200C",
        "U+062E",
        "U+0648",
        "U+0627",
        "U+0647",
        "U+0645",
        "U+0020",
        "U+062E",
        "U+0627",
        "U+0646",
        "U+0647",
        "U+200C",
        "U+0647",
        "U+0627"
      ],
      "received_code_points": [
        "U+0645",
        "U+06CC",
        "U+200C",
        "U+062E",
        "U+0648",
        "U+0627",
        "U+0647",
        "U+0645",
        "U+0020",
        "U+062E",
        "U+0627",
        "U+0646",
        "U+0647",
        "U+200C",
        "U+0647",
        "U+0627"
      ],
      "codepoint_verdict": "EXACT",
      "first_divergence": null,
      "corruption_hints": [],
      "visual_check": {
        "status": "pending",
        "notes": ""
      }
    },
    {
      "fixture_id": "fa-double-zwnj",
      "categories": [
        "persian",
        "zwnj"
      ],
      "expected_code_points": [
        "U+0645",
        "U+06CC",
        "U+200C",
        "U+200C",
        "U+062E",
        "U+0648",
        "U+0627",
        "U+0647",
        "U+0645"
      ],
      "received_code_points": [
        "U+0645",
        "U+06CC",
        "U+200C",
        "U+200C",
        "U+062E",
        "U+0648",
        "U+0627",
        "U+0647",
        "U+0645"
      ],
      "codepoint_verdict": "EXACT",
      "first_divergence": null,
      "corruption_hints": [],
      "visual_check": {
        "status": "pending",
        "notes": ""
      }
    },
    {
      "fixture_id": "fa-boundary-zwnj",
      "categories": [
        "persian",
        "zwnj"
      ],
      "expected_code_points": [
        "U+200C",
        "U+0633",
        "U+0644",
        "U+0627",
        "U+0645",
        "U+0020",
        "U+062F",
        "U+0646",
        "U+06CC",
        "U+0627",
        "U+200C"
      ],
      "received_code_points": [
        "U+200C",
        "U+0633",
        "U+0644",
        "U+0627",
        "U+0645",
        "U+0020",
        "U+062F",
        "U+0646",
        "U+06CC",
        "U+0627",
        "U+200C"
      ],
      "codepoint_verdict": "EXACT",
      "first_divergence": null,
      "corruption_hints": [],
      "visual_check": {
        "status": "pending",
        "notes": ""
      }
    },
    {
      "fixture_id": "fa-arabic-variants",
      "categories": [
        "persian"
      ],
      "expected_code_points": [
        "U+06A9",
        "U+0020",
        "U+0643",
        "U+0020",
        "U+06CC",
        "U+0020",
        "U+064A"
      ],
      "received_code_points": [
        "U+06A9",
        "U+0020",
        "U+0643",
        "U+0020",
        "U+06CC",
        "U+0020",
        "U+064A"
      ],
      "codepoint_verdict": "EXACT",
      "first_divergence": null,
      "corruption_hints": [],
      "visual_check": {
        "status": "pending",
        "notes": ""
      }
    },
    {
      "fixture_id": "fa-en-product-names",
      "categories": [
        "persian",
        "mixed",
        "zwnj"
      ],
      "expected_code_points": [
        "U+0645",
        "U+0646",
        "U+0020",
        "U+0628",
        "U+0627",
        "U+0020",
        "U+0056",
        "U+0053",
        "U+0020",
        "U+0043",
        "U+006F",
        "U+0064",
        "U+0065",
        "U+0020",
        "U+0648",
        "U+0020",
        "U+0059",
        "U+0061",
        "U+007A",
        "U+0053",
        "U+0065",
        "U+0073",
        "U+0020",
        "U+06A9",
        "U+0627",
        "U+0631",
        "U+0020",
        "U+0645",
        "U+06CC",
        "U+200C",
        "U+06A9",
        "U+0646",
        "U+0645"
      ],
      "received_code_points": [
        "U+0645",
        "U+0646",
        "U+0020",
        "U+0628",
        "U+0627",
        "U+0020",
        "U+0056",
        "U+0053",
        "U+0020",
        "U+0043",
        "U+006F",
        "U+0064",
        "U+0065",
        "U+0020",
        "U+0648",
        "U+0020",
        "U+0059",
        "U+0061",
        "U+007A",
        "U+0053",
        "U+0065",
        "U+0073",
        "U+0020",
        "U+06A9",
        "U+0627",
        "U+0631",
        "U+0020",
        "U+0645",
        "U+06CC",
        "U+200C",
        "U+06A9",
        "U+0646",
        "U+0645"
      ],
      "codepoint_verdict": "EXACT",
      "first_divergence": null,
      "corruption_hints": [],
      "visual_check": {
        "status": "pending",
        "notes": ""
      }
    },
    {
      "fixture_id": "fa-email-path",
      "categories": [
        "persian",
        "mixed",
        "url-path",
        "punctuation"
      ],
      "expected_code_points": [
        "U+0627",
        "U+06CC",
        "U+0645",
        "U+06CC",
        "U+0644",
        "U+0020",
        "U+0645",
        "U+0646",
        "U+0020",
        "U+0075",
        "U+0073",
        "U+0065",
        "U+0072",
        "U+0040",
        "U+0065",
        "U+0078",
        "U+0061",
        "U+006D",
        "U+0070",
        "U+006C",
        "U+0065",
        "U+002E",
        "U+0063",
        "U+006F",
        "U+006D",
        "U+0020",
        "U+0627",
        "U+0633",
        "U+062A",
        "U+061B",
        "U+0020",
        "U+0645",
        "U+0633",
        "U+06CC",
        "U+0631",
        "U+0020",
        "U+002F",
        "U+0075",
        "U+0073",
        "U+0072",
        "U+002F",
        "U+006C",
        "U+006F",
        "U+0063",
        "U+0061",
        "U+006C",
        "U+002F",
        "U+0062",
        "U+0069",
        "U+006E",
        "U+002F",
        "U+0079",
        "U+0061",
        "U+007A",
        "U+0073",
        "U+0065",
        "U+0073",
        "U+0020",
        "U+0631",